"","date","Title","Description","Img"
"1",2022-12-16,"May I Help You: Episodes 13-14","Hold on to your hats, people. Our penultimate week comes with a shocking reveal, proving that the coldest of hearts lie beneath the warmest of exteriors. 
 (more…)","https://www.dramabeans.com/wp-content/uploads/2022/12/MayIHelpYou14-00001.jpg"
"2",2022-12-16,"[Beanie Review] Behind Every Star","It's your time to shine, Beanies! Add your voice to the community and help Dramabeans provide trustworthy fan(atic) reviews for people looking for their next drama.Provide a quick...","https://www.dramabeans.com/wp-content/uploads/2022/10/BehindEveryStar_reviewb_.jpg"
"3",2022-12-16,"[2022 Year in Review] Storytelling lessons","I almost didn't write an essay this year — not because I didn't make it through a truckload of dramas or have lots of words to share, but because it was...","https://www.dramabeans.com/wp-content/uploads/2022/01/OBS1112_8.jpg"
"4",2022-12-16,"Open Thread #791","Happy Friday everyone!Here is your Open Thread, which is here for you to chat about anything you want, whether it be drama-related or not. Nothing's off-topic here! Spoilers may...","https://www.dramabeans.com/wp-content/uploads/2022/03/OT_16.jpg"
