"","date","Title","Description","Img"
"1",2023-04-13,"[Beanie Review] Our Blooming Youth","It's your time to shine, Beanies! Add your voice to the community and help Dramabeans provide trustworthy fan(atic) reviews for people looking for their next drama.Provide a quick...","https://d263ao8qih4miy.cloudfront.net/wp-content/uploads/2023/01/OurBloomingYouth_reviewb.jpg"
"2",2023-04-13,"Oasis: Episodes 11-12","Absence makes the love triangle grow stronger when one of our leads is out for the count. As another time jump comes our way, we’ve got new jobs, lingering...","https://d263ao8qih4miy.cloudfront.net/wp-content/uploads/2023/04/Oasis11-12_1-scaled.jpg"
"3",2023-04-13,"[Beanie Recs] Capers and heists","
Ahoy, Beanies! It's time to gather your collective genius for a recommendation series that features you and your drama knowledge. Each week we'll drop a drama conundrum and leave it...","https://d263ao8qih4miy.cloudfront.net/wp-content/uploads/2022/05/BeanieRecs.jpg"
"4",2023-04-13,"[Beanie Review] Our Blooming Youth","It's your time to shine, Beanies! Add your voice to the community and help Dramabeans provide trustworthy fan(atic) reviews for people looking for their next drama.Provide a quick...","https://d263ao8qih4miy.cloudfront.net/wp-content/uploads/2023/01/OurBloomingYouth_reviewb.jpg"
